,0
22,"Causality-based Explanation. As illustrated in Figure , conformity bias can be understood from the
additional causal path . Public opinion depends on item property , Article . Publication date: December 2020.Bias and Debias in Recommender System: A Survey and Future Directions •
and impacts user judgment . This undesirable phenomenon would distort the conditional distribution,
making the training distribution deviate from reflecting user true preference.
From another perspective, conformity bias creates spurious association between and𝑅through the path. The model trained on observed data would easily capture spurious association, leading to poor
performance.
3.1.5 Position Bias. Position bias is very common in recommendation, particularly in advertisement system or
search engine:
•Position Bias. Position bias happens as users tend to interact with items in higher position of the recom-
mendation list regardless of the items’ actual relevance so that the interacted items might not be highly
relevant.
"
23,"Here “relevance” is widely used in the field of information retrieval, which denotes how the items are preferred by
the users. Popularity bias happens in implicit feedback data and describes a tendency of users to notice or interact
with items in certain positions of lists with higher probability, regardless of the items’ actual relevance.
For example, recent studies on eye tracking demonstrate that users are less likely to browse items that are
ranked lower in vertical lists, while they only examine the first few items at the top of lists. Moreover,
Maeve et al. shows that users often trust the first few results in the lists and then stop assessing the rest,
without evaluating the entire list holistically . As such, the data collected from user feedback towards the
recommended lists may fail to reflect user preference faithfully .
Causality-based Explanation. Figure illustrates the generative process of users’ feedback on recom-
mendation lists, where each item is companied with a position in the previous recommendation list.
The effect of position outcome 𝑆is along the path , the display position would
impact the probability that the item is exposed to the us along the path , the position would
also hinder users’ own judgement, as users trust the recommender system and may over-estimate the relevance
of the highly-ranked items. As such, position bias is quite complex and would skew both the data observation
as well as the user judgment , making the training distribution deviate significantly from
the ideal test one.
"
24,"From another perspective, position bias creates two spurious associations between the
paths, which should be conquered.
3.2 Bias in Model
Bias is not always harmful. In fact, a number of inductive biases have been added deliberately into the model
design to achieve some desirable characteristics:
•Inductive Bias. Inductive bias denotes the assumptions made by the model to better learn the target function
and to generalize beyond training data.
The ability to generalize the prediction to unseen examples is the core of machine learning. Without assumptions
on the data or model, generalization cannot be achieved since the unseen examples may have an arbitrary output
space. Similarly, building a RS needs to add some assumptions on the nature of the target function. For example,
Johnson et al. assumes an interaction can be estimated by embedding inner product, while He et al.
adopts the neural network as its better generalization. Besides target function, inductive bias have been added
in other aspects. An example is the adaptive negative sampler, which aims to over-sample
the “difficult” instances in order to increase learning speed, even though the resultant loss function will differ
significantly from the original. Another example is the discrete ranking model which embeds user
and items as binary codes to improve the efficiency of recommendation, which is at the expense of sacrificing the
representation ability.
"
25," Item popularity VS. recommendation frequency, where items were classified into
three different groups:  denoting the set of most popular items that take up around 20 entire ratings, denoting the set
of most unpopular items that take up 20% entire ratings and M denotes the rest. The figure was reproduced from with
authors’ permission.
3.3 Bias and Unfairness in Results
Besides the aforementioned biases in data or model, two important biases in recommendation results have been
studied, which are defined as follows:
•Popularity Bias. Popular items are recommended even more frequently than their popularity would war-
rant .
"
26,"The long-tail phenomenon is common in RS data: in most cases, a small fraction of popular items account for
the most of user interactions. When trained on such long-tailed data, the model usually gives higher scores to
popular items than their ideal values while simply predicts unpopular items as negative. As a result, popular items
are recommended even more frequently than their original popularity exhibited in the dataset. Popularity bias
has been empirically verified by Abdollahpouri et al. Figure 6 shows relationship between item popularity
and recommendation frequency. We can find most of recommended items are located at high popularity area.
In fact, they are recommended to a much greater degree than even what their initial popularity warrants .
Ignoring the popularity bias results in many issues: 1) It decreases the level of personalization and hurts the
serendipity. Since the preferences of different users are diverse, always recommending popular items will hurt
user experience, especially for the users favoring niche items. It decreases the fairness of the recommendation
results . Popular items are not always of high quality. Over-recommending popular items will reduce the
visibility of other items even if they are good matches, which is unfair.Popular bias will further increase the
exposure opportunities of popular items, making popular items even more popular – the collected data for future
training becomes more unbalanced, raising the so-called “Matthew effect” issue.
"
27,"Another type of bias arises in the recommendation results is unfairness. Fairness has attracted increasing
attention in recent years. A consensual definition of fairness is “ absence of any prejudice or favoritism towards an
individual or a group based on their intrinsic or acquired traits ” , and the unfairness can be defined as follow:
•Unfairness. The system systematically and unfairly discriminates against certain individuals or groups of
individuals in favor others .
Unfairness issue has been an obstacle to making recommender systems more entrenched within our society.
In particular, based on attributes like race, gender, age, education level, or wealth, different user groups are
usually unequally represented in data. When training on such unbalanced data, the models are highly likely to
learn these over-represented groups, reinforce them in the ranked results, and potentially result in systematic
discrimination and reduced the visibility for disadvantaged groups ( e.g.,under-representing the minorities, racial
or gender stereotypes). For example, in the context of job recommendation, previous work found
that, compared to men, women saw less ads about high paying jobs and career coaching services, which is
Article . Publication date: December 2020.Bias and Debias in Recommender System: A Survey and Future Directions .
Biases in data
Conformity  Bias
Position Bias
Selection Bias
Exposure BiasOn user judgment
On data observation
imbalance
Popularity  Bias
UnfairnessBiases in ResultsInductive  BiasBias in Model
Via serving & collection  stage
Relations between seven types of biases.
caused by gender imbalance. Analogously, friend recommendation in social graphs may reinforce historical
biases towards a majority and prevent minorities from being social influencers with high reach . Another
similar issue has been found in book recommendation, where the methods prefer recommending books of male
authors. Analyzing the unfairness issue inherent in recommendation is therefore becoming essential and
desirable.
3.4 Feedback Loop Amplifies Biases
Real-world recommender systems usually create a pernicious feedback loop. Previous subsections summarize the
biases occurred in different stages of the loop, while these biases could be further intensified over time along the
loop. To better understand this effect, figure 7 illustrates the relations of seven types of biases. Data biases would
incur or intensify the data imbalance, exacerbating bias issues in recommendation results ( Data bias→Data
imbalance→Bias in Results ); while the biased recommendations would in turn impact the decisions, exposure,
and selections of users, reinforcing the biases in users’ future behaviors ( Bias in Results→Data Bias ).
"
28,"Taking the
position bias as an example, top items typically benefit from a greater volume of traffic, which in turn increases
their ranking prominence and the volume of traffic they receive, resulting in a rich-get-richer scenario.
Many researchers also study the impact of feedback loop on the popularity bias. Their simulated
results show that feedback loop will amplify popularity bias, where popular items become even more popular
and non-popular items become even less popular. These amplified biases also will decrease the diversity and
intensify the homogenization of users, raising the so-called “echo chambers” or “filter bubbles”.
Interestingly, figure also shows that some data biases can be self-reinforced ( Data bias Data imbalance
→Data bias ). Taking conformity bias as an example, as users tend to behave similarly to the major groups, the
extent of the data imbalance would increase with time going by, which in turn impacts and exacerbates the
conformity bias. Similar situations apply to the selection bias and exposure bias which are also affected by the
data imbalance.
"
29,"4 DEBIASING METHODS
A large number of methods have been proposed to mitigate the effects of bias or unfairness. Table 2 lists the
reviewed methods, as well as their strengths and weaknesses. we classify them according to which biases they
addressed and which types of methods they adopted.Article . Publication date: December 2020.12 •Chen and Dong, et al.
A lookup table for the reviewed methods for recommendation debiasing.
Addressed issues Categories How? Strengths? Weaknesses? Publications
Selection BiasEvaluatorPropensity Score Weight the dataGeneral,
Theoretical-soundnessRequiring proper
propensities
ATOP Specific design Theoretical-soundnessRequiring two
strong assumptions
TrainingJoint Generative Model Model missing mechanism ExplainableRequiring assumptions
on data generation,
Hard to train
Data Imputation Impute pseudo-labels SimpleHighly sensitive
to pesduo-labels
Propensity Score Weight the data Theoretical-soundnessHigh variance,
Requiring proper
propensities
Doubly Robust Model Impute+WeightTheoretical-soundness,
RobustRequiring proper
propensities
or pesduo-labele
Conformity BiasModeling popularity influenceDisentangle conformity
effect from user preferenceExplainableRequiring assumptions
on data generation
Modeling social influenceDisentangle social effect
from user preferenceExplainableRequiring assumptions
on data generation
Exposure BiasEvaluator Propensity Score Weight the data Theoretical-soundnessRequiring proper
propensities
TrainingHeuristicDown-weight unobserved
data heursticallySimpleCoarse-grained,
Heuristical
SamplingDown-weight unobserved
data via samplingEfficientCoarse-grained,
Requiring heuristic
or side information
Exposure-based modelWeight the data via
exposure modelExplainable,
Learn flexible weightsHard to train
Propensity Scores Weight the observed data Theoretical-soundnessRequiring proper
propensities,
High variance
Causality-based MethodsRemove spurious associations
via causal inferenceExplainableRequiring assumptions
on data generation
Others 
Position BiasClick ModelsModel the generative
process of clicksExplainableRequiring assumptions
on data generation,
hard to train
Propensity Score Weight the data Theoretical-soundnessHigh variance,
Requiring proper
propensities,
Fail to model trust
Trust-aware ModelsIntroduce offset terms
to remove trust effectTheoretical-soundness,
Capture trust effectHigh variance,
Requiring proper
propensities,
Fail to model trust
For multiple data biases
and their combinationsUniversal modelTransfer the knowledge
from unbiased data to
perform debiasingUniversal,
AdaptiveRequiring a set of
unbiased data
Popularity BiasRegularizationIntroduce regularization
termsSimple, Straightforward Possibly hurt accuracy
Adversarial LearningLeverage adversary to
bridge the gap between
niche and popular itemsBalancing representation Possibly hurt accuracy
Causal GraphLeverage causal graph
to elucidate and mitigate
popularity biasExplainableRequiring assumptions
on data generation
Others
UnfairnessRebalancingDirectly balance the data
or recommendation resultsStraightforward Possibly hurt accuracy
RegularizationFormulate the fairness
criteria as a regularizerStraightforward Possibly hurt accuracy
Adversarial LearningLeverage adversary to
isolate the effect of
sensitive attributesFair representation Possibly hurt accuracy
Causal ModelingEstimate fairness with
intervening sensitive
attributesExplainable,
Counterfactual fairnessRequiring assumptions
on data generation
Others
Loop effectUniform DataIntervene in the system
with a random logging policyStraightforward,
EffectiveHurting the user
experience and the
system profit
Reinforcement learningIntervene in the system
with a smarter strategy
for long-term benefitsAdaptively balancing
exploration-exploitationHard to train,
Off-policy evaluation
is chanllenging
Publication date: December 2020.Bias and Debias in Recommender System: A Survey and Future Directions •
"
30,"4.1 Methods for Selection Bias
Training and testing a recommendation model on the observed rating data will suffer from the selection bias,
as the observed ratings are not a representative sample of all ratings. Here we fist introduce how to evaluate a
recommendation model under biased rating data, and then review four kinds of methods that mitigates selection
bias on recommender training.
4.1.1 Debiasing in evaluation. Given a recommendation model, we want to evaluate its performance on rating
prediction or recommendation accuracy. Standard evaluation metrics like Mean Absolute Error (MAE), Mean
Squared Error, Discounted Cumulative or Precision can be written as:
"
31,"where denotes indicator function the internal condition holds), 𝑟𝑢𝑖denotes the true rating values
of the item𝑖given by the user the predicted rating values by the recommendation model. As
true ratings 𝑟are usually partially observed4. The conventional evaluation usually use the average over only the
observed entries:
"
32,"where𝑠𝑢𝑖denotes the number of observed ratings in the dataset. We can find is not an unbiased estimate
of the true performance :
"
33,"where is expected over the observation probability. The gap is caused by selection bias, making the
observed ratings not a representative sample of all ratings. Two strategies have been presented in recent work.
Propensity Score. To remedy the selection bias in evaluation, some recent work considers a recommen-
dation as an intervention analogous to treating a patient with a specific drug. In both tasks, we have only partial
knowledge of how much certain patients (users) benefit from certain treatments (items), while the outcomes for
most patient-treatment (user-item) pairs are unobserved. A promising strategy for both tasks is weighting the
observations with inverse propensity scores. The propensity, which is defined as the marginal probability
of observing a rating value for certain user-item pair can offset the selection bias. The
proposed estimator is defined as:
"
34,"Steck propose another unbiased metric ATOP to evaluate recommendation performance
with two mild assumptions:  the relevant (high) rating values are missing at random in the observed data;
Concerning other rating values, we allow for an arbitrary missing data mechanism, as long as they are missing
with a higher probability than the relevant rating values. They define the ATOP as:
"
35,"which computed from biased explicit feedback data and
𝑢 denotes the number of observed relevant (preferred)
items of the user
𝑢 counts the relevant ones in the top 𝑘. The authors prove ATOPobs
𝑢is an unbiased
estimate of the average recall and proportional to the precision averaged over users.
Discussion. Propensity scores and ATOP are two subtle strategies to remedy selection bias, but they still
have two serve weaknesses. The unbiasedness of the IPS-based estimator is guaranteed only when the true
propensities are available. The IPS estimator will still be biased if the propensities are specified unproperly.
"
36,"The unbiasedness of the ATOP is guaranteed only when the two assumptions hold. In practice, the missing
mechanism is often complex and the assumptions are not always valid. Developing a robust and effective remains
a challenge.
4.1.2 Debiasing in model training. In the following, we will review four kinds of methods on mitigating selection
bias on recommender training.
Joint Generative Model. Note that the main reason for the selection bias is that users are free to deliberately
choose which items to rate. Thus, a straightforward strategy for mitigating selection bias is to jointly consider both
rating prediction task and missing data prediction task. Some recent work propose to jointly model the generative
process of rating values and the missing mechanism. Their generative process can be depicted with Figure ,
with the assumption that the probability of users’ selection on items depends on users’ rating values
for that item . Correspondingly, 𝑠𝑢𝑖has been modeled dependent on 𝑟𝑢𝑖with a mixture of Multinomials,
Logit model, MF model, binomial mixture model , or social-enhanced model. In this
way, user’s preference can not only learn from rating values but also from the missing mechanism.
"
37,"Although this kinds of methods is explainable and sometimes effective in some scenarios, jointly modeling the
missing mechanism and rating values will lead to a highly complex model, which is hard to be trained. What’s
worse, the architecture of missing data models are usually heuristically designed. The hypothesis on distribution
may not hold in some real cases.
Data Imputation. Note that the inherent nature of selection bias is that the data is missing not random.
A straightforward solution for selection bias is to impute the missing entries with pseudo-labels, such that
the observed data distribution is close to the ideal uniform one. For example, Steck et. Publication date: December 2020.Bias and Debias in Recommender System: A Survey and Future Directions •
al. propose a light imputation strategy that directly impute the missing data with a specific value ,
with optimizing the following objective function:
"
38,"𝑊𝑢𝑖is introduced to
downweight the contribution of the missing ratings.
However, as imputed rating values are specified in a heuristic manner, this kind of methods will suffer
from empirical inaccuracy due to inaccurate imputed rating values. Such inaccuracy will be propagated into
recommendation model training, resulting in sub-optimal recommendation performance.
To resolve this issue, Saito et al. propose to learn imputation values with an asymmetric tri-training
framework. They first pre-train two predictors with two specific recommendation models to generate a
reliable dataset with pseudo-ratings and then trained a target recommendation model on the pseudo-ratings.
Theoretical analysis presented in shows that the proposed method optimizes the upper bound of the
ideal loss function. However, the performance of asymmetric tri-training depends on the quality of pre-trained
predictor , while a satisfied itself is hard obtained from biased data. Nevertheless, model-based imputation
strategy is a promising direction for mitigating selection bias, which deserve future exploring.
Propensity Score. Besides on evaluation, propensity score can be utilized to mitigate selection bias on model
training . This kind of methods directly use the IPS-based unbiased estimator as the objective and
optimize the following risk function:
"
39,"Except for the propensities that act like weights for each loss term, the training objective is
identical to the standard recommendation objective. Also, thanks to the propensities, the selection bias can be
mitigated as the IPS-based estimator is an unbiased estimation of the True Risk:
"
40,"However, as discussed in the previous subsection, specifying appropriate propensity scores is critical. The
performance of IPS-based model depends on the accuracy of the propensities. Moreover, propensity-based methods
usually suffer from high variance, leading to non-optimal results especially when the item popularity or
user activeness is highly skewed.
Doubly Robust Model. As data imputation-based models often have a large bias due to mis-specification
while IPS-based model usually suffer from high variance, Wang et al. propose to combine the two kinds of
models and enjoy a desired double robustness property: the capability to remain unbiased if either the imputed
errors or propensities are accurate. They define the following objective function:
"
41,"where𝑟
𝑢𝑖denotes the imputed value for certain user-item pair . The theoretical and empirical analyses
presented in validate superiority over both IPS-based and imputation-based models.
Although the model is more robust than single method, it still requires relatively accurate propensity score or
imputation data, which is usually hard to specify. Otherwise, its performance also suffers.Article . Publication date: December 2020.16 •Chen and Dong, et al.
"
42,"4.2 Methods for Conformity Bias
Conformity bias occurs as users are normally influenced by others opinion so that the rating values are deviated
from users’ true preference. Two types of methods have been proposed to address the conformity bias. The first
type of work considers users’ behaviors conform to public opinions. For example, Liu et al. directly leverage
three important features the base recommendation model, where the number of ratings for
item𝑖before user 𝑢rates it, the average rating and the rating distribution. The predicted rating is
generated from XGBoost :
where𝑡𝑢𝑖denotes the prediction returned by basic recommendation model and the strength of
conformity. This way, we can disentangle the effect caused by conformity bias from users’ true preference and
make a recommendation accordingly. Some recent work further study conformity bias in a more fine-grained
manner. Zheng et al. propose to model personalized conformity effect as users have different sensitivities to
the public opinions; while Zhao et al. model time-aware conformity effect by considering item dynamic
popularity.
The other type of methods treat user’s rating values as synthetic results of user preference and social influence. Thus, similar to, they directly leverage social factors in the base recommendation model
to generate final prediction and introduce specific parameters to control the effect of social conformity bias.
4.3 Methods for Exposure Bias
Exposure bias occurs as users are only exposed to a part of items so that unobserved interactive data does not
always mean negative signal. Exposure bias will mislead both the model training and evaluation. Here we review
the work on correcting exposure bias.
"
43,"4.3.1 Debiasing in evaluation . A straightforward strategy for debiasing in RS evaluation is using the inverse
propersity score, which also has been applied to address the selection bias. Yang et al. first illustrate
evaluation bias in terms of conventional metrics such on the implicit feedback data,
and leverage the IPS framework to offset the exposure bias.
"
44,"where the predicted ranking of item by the recommendation model and G𝑢denotes
the set of all relevant items for user. needs to be adapted for different metrics, such as:
"
45,"However, due to the exposure bias, only partial preferred items are observed, making the model often be evaluated
on the biased implicit feedback as:
"
46,"𝑢denotes the preferred items that have been exposed to the user . As users usually have biased exposure,
the output of evaluator does not conform the true performance.
To address this problem, similar to the treatment for selection bias in explicit feedback data, Yang et al.
propose to weight the each observation with the inverse of its propensity for implicit feedback data. The intuition
is to down-weight the commonly observed interactions, while up-weighting the rare ones. Thus, the IPS-based
unbiased evaluator is defined as follow:
"
47,"4.3.2 Debiasing in model training. To deal with the exposure bias and extract negative signal from the implicit
feedback, a conventional strategy is treating all the unobserved interactions as negative and specify their
confidence. The objective function of most such methods can be summarized as follow:
"
