,0
75,"Regularization. The basic idea of the regularization line is to formulate the fairness criteria as a regularizer
to guide the optimization of model. A general framework, Learned Fair Representation, is proposed in,
which generates the data representations to encode insensitive attributes of data, while simultaneously removing
any information about sensitive attributes. the protected subgroup. Formally, it is composed of three loss
components:
where ·is the reconstruction loss between input data 𝑋and representations with an encoder
function is the prediction error in generating prediction, such as cross entropy ·is
a regularization term that measures the dependence between 𝑅and sensitive attribute 𝐴, which is defined as. Publication date: December 2020.Bias and Debias in Recommender System: A Survey and Future Directions •
"
76,"fairness constraints such as demographic parity:
relies on the distance of representation 𝑅and the centroid representation the group
Using such a regularization makes the encoded representation sanitized and blind to whether or not the individual
from the protected group.
Studies on this research line have been extensively conducted by subsuming different fairness formulations
under the foregoing framework. Earlier, Kamishima et al. first claimed the importance of neutrality in recommendation, and then proposed two methods one regularization-based
matrix completion method, where the fairness regularizer is formulated as the negative mutual information between sensitive attribute 𝐴and prediction one graphical model-based method , where
the fairness regularizer accounts for the expected degree of independence between 𝐴and𝑌in the graphical
model. Later, Kamishima et al. generalized these work to implicit feedback-based recommender systems.
Analogously, Yao et al.
"
77,"proposed four fairness metrics in collaborative filtering, and used similar
regularization-based optimization method to mitigate different forms of bias.
Moreover, there are some regularization-based studies working on more specific scenarios. For example,
Abdollahpouri et al.focused on controlling popularity bias in learning-to-rank recommendation, and pro-
posed a regularizer that measures the lack of fairness for the short-head and medium-tail item sets in a given
recommendation list to improve fairness during model training. Xiao et al. worked on fairness-aware
group recommendation, and designed a multi-objective optimization model to minimize the utility gap between
group members. Burke et al.proposed a regularization-based matrix completion method to reweigh differ-
ent neighbors, in order to balance the fairness between protected and unprotected neighbors in collaborative
recommendation. Zhu et al.presented a fairness-aware tensor-based recommendation approach, which
uses sensitive latent factor matrix to isolate sensitive features and then uses a regularizer to extract sensitive
information which taints other factors. More recently, going beyond the pointwise fairness metrics in ranking,
Beutel et al. considered pairwise fairness of user preference between clicked and unclicked items, and offered
a new regularizer to encourage improving this metric.
"
78,"Besides in optimization objective, regularization also has been added in the ranking policy to address the
unfairness issue. considers the problem in dynamic ranking system, where the ranking function dynamically
evolves based on the feedback that users provide, and present a new sorting criterion FairCo as follows:
where the error term errmeasures the fairness violation has been introduced. The intuition behind FairCo is
that the error term pushes the items from the underexposed groups upwards in the ranking lists. Fairness-aware
constraints have also been introduced in models. Efficient policy-gradient
algorithms have been developed for model optimization.
Adversarial Learning. Similar with the idea of, the line of adversarial learning aims to get
fairness as a side-effect of fair representation. The basic idea is to play a min-max game between the prediction
model and an adversary model, where the adversary tries to predict the sensitive attributes from the data
representations, so minimizing the performance of the adversary is to remove the information pertinent to
the sensitive attributes in the representation. Towards this goal, a general framework, Adversarial Learned Fair. Publication date: Decembe.Chen and Dong, et al.
Recommendation with attribute protection.
"
79,"The figure was reproduced from the authors’
permission.
Representation , is proposed in which is formulated as follows:

where is the reconstruction loss to quantify the information retained in the representations 𝑅about the
data𝑋by the ability of an encoder or decoder network; is to predict a predictor network;
𝜃encompasses the parameters of the encoder/decoder and predictor networks; and is to quantify the
independence between the representation 𝑅and the sensitive attributes 𝐴via an adversary network.
Assuming𝐴is binary is formulated as for binary adversary network
which satisfies the fairness constraint of demographic parity. Maximizing is to optimize the adversary’s
parameters , while minimizing is to optimize the representation parameters .
Only recently have researchers considered this line in the field of recommendation. For example, et
al. leveraged adversarial learning to enhance the score distribution similarity between different groups.
Bose et al. and Wu et al.
"
80,"extended the ALFR framework by enforcing compositional fairness constraints
on graph embeddings for multiple sensitive attributes, which are evaluated in the scenarios of item or friendship
recommendation. Wherein, instead of fair. single sensitive attribute, it makes the graph embeddings be in-
variant. different combinations of sensitive attributes by employing a compositional encoder in the adversary
network. Building upon the ALFR framework, et al. proposed a framework termed recommendation with
attribute protection to recommend items based on user preference, while simultaneously defensing against
private-attribute inference attacks. In particular, the prediction and adversarial networks are instantiated as the
sensitive attribute inference attacker and the Bayesian personalized recommender, respectively. Analogically, Li
et al.targeted at personalized counterfactual fairness with leveraging adversarial learning to isolated the
personalized sensitive attributes.
Causal Modeling. Inspired by the success of causal modeling , studying fairness from the causal has attracted increasing attentions. In general, fairness is formulated as the causal
effect of the sensitive attribute, which is evaluated by applying counterfactual interventions over a causal graph.
For example, et al.
"
81,"focused on fairness-aware ranking, and argued that the fairness constraints based. Publication date: December 2020.Bias and Debias in Recommender System: A Survey and Future Directions
on statistical parity hardly measure the discriminatory effect. Hence, they built a causal graph that consists of the
discrete profile attributes and the continuous score, and proposed a path-specific effect technique to detect and
remove both direct and indirect rank bias. Kusner et al. introduced the notion of counterfactual fairness,
which is derived from Pearl’s causal model. It considers the causal effect by evaluating the counterfactual
intervention — more formally, for a particular individual, whether its prediction in the real world is identical to
that in the counterfactual world where the individual’s sensitive attributes had been different.
Others. There are some other strategies on unfairness. For example. proposed to add an autoencoder
layer when learning user and item representation. This treatment can enforce that the specific unique properties
of all users and items are sufficiently preserved in the representation, mitigating the bias towards mainstream
users. Islam et al. first computed a group-specific bias direction, and then debiased each user representation
by subtracting its component in that direction. Ge et al.studied on the problem of long-term fairness and
proposed a fairness-constrained reinforcement learning algorithm to adapt dynamic fairness requirement.
4.8 Methods for Mitigating Loop Effect
Practise recommender systems usually create a pernicious feedback loop, which will create bias and further
intensify bias over time. To deal with this problem, besides the aforementioned strategies on a specific bias, a
surge of methods have been proposed recently to reduce the iterated bias that occurs during the successive
interaction between users and recommender system.
Uniform data. Leveraging uniform data is the most straightforward way to address the problem. To collect
uniform data, this kind of methods intervene in the system by using a random logging policy instead of a normal
recommendation policy. That is, for each user, they do not use the recommendation model for item delivery,
but instead randomly select some items and rank them with a uniform distribution. The uniform data
often provide gold-standard unbiased information because it breaks the feedback loop and is not affected by
various biases. However, the uniform policy would inevitably hurt users’ experience and the revenue of the
platform, thus it is usually restricted to a small percentage of online traffic. Therefore, how to correct the bias
with a small uniform data is a key research question. Yuan et al. learn a imputation model from the uniform
data and apply the model to impute the labels of all displayed or non-displayed items. Rosenfeld et al. and
Bonner et al. employ two recommendation models for the biased data and uniform data, and further use a
regularization term to transfer the knowledge between the models; Liu et al.leverage knowledge distillation
to extract information from uniform data to learn a unbiased recommendation model. leverage
influence function to reweight training instances so that it has less loss in an unbiased validation set. Chen et
al.proposed to learn the optimal debiasing configures from the unbiased data.
Reinforcement learning. Collecting uniform data with a random policy is not a satisfactory strategy as it
hurts recommendation performance. Smarter recommendation strategy or policy needs to be explored. There
exists an exploration-exploitation dilemma in recommender system, where the exploitation is to recommend
items that are predicted to best match users’ preference, while the exploration is to recommend items randomly
to collect more unbiased user feedback to better capture user preference. To deal with this problem, a large
number of work explores interactive recommendation by building a reinforcement learning  agent. Figure 9
illustrates the system-user interactions with a RL agent. Different from traditional recommendation methods,
RL considers the information seeking tasks as sequential interactions between an RL agent (system) and users
(environment). During the interaction, the agent can continuously update its strategies 𝜋according to users’
history information or feedback and generates a list of items that best match users’
preferences or explore users’ preference for long term reward. Then, the users will give the feedback on the recommendation lists to update the agent. Therefore, RL could balance the
competition between the exploitation and exploration and maximize each user’s long term satisfaction with. Publication date: December.
Fig. 9. The system-user interactions with a RL aggent. The figure is plotted referring to  with permission.
the system . Some recent work balance exploitation and exploration in bandit setting
with𝜀-greedy, Boltzmann Exploration or Upper Confidence Bounds (UCB). Some work estimates action-value
reward function network using the Bellman equation and finds the best strategy with the largest
function value. Also, the actor network has been adopted recently to learn the best policy by
maximizing the long term reward.
A challenge of recommender is how to evaluate a policy. It is best to deploy it online, in the form
of an A/B test, which however is expensive and time-consuming in terms of engineering and logistic overhead
and also may harm the user experience when the policy is not mature . Off-policy evaluation is an alternative
strategy that uses historical interaction data to estimate the performance of a new policy. However, off-policy
evaluation will suffer from bias as the data are collected by an existing biased logging policy instead of uniform
policy. To correct the data bias, Chen et al.proposes to weight the policy gradient with the inverse of the
probability of historical policy. Inspired by, some work further explore off-policy evaluation
for non-stationary recommendation environments or slate recommendation. However, as claimed by Jeunen et
al. existing off-policy learning methods usually fail due to stochastic and sparse rewards. Therefore, they
further propose to leverage supervised signal with IPS strategy to better evaluate a policy. Nevertheless, off-policy
evaluation is still a challenging task especially when the historical policy is not provided, which deserves for
further exploration.
Others. There are some other strategies to mitigate the loop effect. Sun et al. leverage blind spot term
to let items be close to each other in the latent space. Sinha et al.provide an algorithm for deconvolving
feedback loops to recover users’ truth rating values.
This section discusses open issues and point out some future directions.
5.1 Evaluation of Propensity Scores
As mentioned before, Inverse Propensity Score is a conventional strategy to debias. However, the effectiveness
and unbiasedness of an IPS strategy are guaranteed only when the propensity scores are properly specified. How
to obtain proper propensity scores remains an important research question. Existing methods usually assume
the ideal propensities are given. Although the evaluation of propensity scores in some simple scenarios, for
position bias, have been explored, evaluating propensity scores in more complex scenarios, such as for selection
bias or exposure bias, is still an open problem and deserves further exploration. Publication date: December 2020.Bias and Debias in Recommender System: A Survey and Future Directions •
"
82,"5.2 General Debiasing Framework
From former studies, we can find that existing methods are usually designed for just addressing one or two specific
biases. However, in the real world, various biases usually occur simultaneously. For example, users usually rate
the items that they like and their rating values are influenced by the public opinions, where conformity bias and
selection bias are mixed in the collected data. Besides, the distribution of rated user-item pairs is usually inclined
to popular items or specific users groups, making the recommendation results easily suffer from popularity bias
and unfairness. It is imperative that recommender systems require a general debiasing framework to handle the
mixture of biases. It is a promising but largely under-explored area where more studies are expected. Although
challenging, the simple case — the mixture of just two or three biases — is worth to be explored first.
IPS or its variants, which have been successfully applied for various biases, are a promising solution for this
problem. It will be interesting and valuable to explore a novel IPS-based framework, which summarizes the
applications of IPS on different kinds of biases and provides a general propensity score learning algorithm.
"
83,"5.3 Better Evaluation
How to evaluate a recommender system in an unbiased manner? It is an essential question for both researchers
and practitioners in this area. Existing methods either require accurate propensity scores or rely on a considerable
amount of unbiased data. However, the accuracy of the former can not be guaranteed, while the latter hurts user
experience and is usually constrained on a very small percentage of online traffic. Uniform data provides gold-
standard unbiased information but its small scale makes it insufficient to thoroughly evaluate a recommendation
model due to high variance. Exploring new evaluators using large-scale biased data and small-size unbiased data
will be an interesting direction. More theoretical studies are expected, analyzing the expectation, bounds and
confidences of the proposed evaluator.
Due to popularity bias and unfairness, the evaluation exhibits more difficulties. Different work usually adopts
different evaluation criteria of popularity bias or unfairness. This creates an inconsistent reporting of scores, with
each author reporting their own assortment of results. The performance or comparisons of existing methods can
not be well understood. As such, we believe that a suite of benchmark datasets and standard evaluations metrics
should be proposed.
"
84,"5.4 Knowlege-enhanced Debiasing
It is natural that exploiting the abundant auxiliary information would improve the efficacy of debiasing. Recent
years have seen some examples that leverage attributes of users or items to correct biases in recommendation.
An interesting direction is how to better exploit this auxiliary information as the attributes are not isolated
but connected with each other forming a knowledge graph. The knowledge graph captures much more rich
information, which could be useful to understand the data bias. For example, given a user 𝑢1watches movies 𝑖1
and𝑖2, both of which are directed by the same person 𝑝1and of the same genre 𝑝2. From the knowledge graph,
we can deduce that the 𝑢1are highly likely to have known the movies that connect with entities 𝑖1,𝑖2,𝑝1or𝑝2.
This exposure information is important for exposure bias correction. Another advantage of knowledge graph
is its generality. All data, data sources, and databases of every type can be represented and operationalized by
the knowledge graph. Knowledge graph would be a powerful tool for developing a feature-enhanced general
debiasing framework.
"
85,"5.5 Explanation and Reasoning with Causal Graph
Cause graph is an effective mathematical tool for elucidating potentially causal relationships from data, deriving
causal relationships from combinations of knowledge and data, predicting the effects of actions, and evaluating
explanations for observed events and scenarios. As such, it is highly promising for the debiasing tasks in. Publication date: December •Chen and Dong.
recommendation. On the one hand, the key of debaising is to reason the occurrence, cause, and effect over
recommendation models or data. Most biases can be understood with mild cause assumptions and additional
confounding factors in the causal graph. The effect of bias also can be inferred through the casual paths in
the graph. On the other hand, recommendation is usually considered as an intervention analogous to treating
a patient with a specific drug, where counterfactual reasoning needs to be conducted. What happens if the
recommended items are exposed to the users? Causal graph provides potentials to answer this question. The
formulated unbiased recommendation criteria can be derived with causal graph.
Nowadays, making explainable recommendations is increasingly important as it helps to improve the trans-
parency, persuasiveness, effectiveness, trustworthiness, and satisfaction of a RS. Explainable recommendation
and debiasing are highly related in the sense that they both address the problem of why: they both need to
answer why certain items are recommended by the algorithm. When causal graph is promising to address the
bias problem in a RS, it can also provide opportunities to give explanation from the strong causal paths in the
graph.
To this end, the next step would to be to design better and suitable causal graph, which is capable of reasoning,
debiasing, and explanation. We believe causal model will bring the recommendation research into a new frontier.
"
86,"5.6 Dynamic Bias
In real world, biases are usually dynamic rather than static. For example, the fashion of clothes changes frequently;
users experience many new items and may get new friends every days; the recommendation system will update
its recommendation strategy periodically. All in all, factors or biases often evolve with the time going by. It
will be interesting and valuable to explore how bias evolves and analyze how the dynamic bias affects a RS.
5.7 Double-edged Sword of Bias
Bias is not always harmful. For example, popularity bias has been validated as a double-edged sword.
Popularity bias not only results from conformity but also item quality. Appropriately leveraging popularity bias
in recommendation may improve the performance. It will be interesting and valuable to explore the double-edged
nature of other biases, fostering their benign effects while circumventing their harmful.
"
87,"5.8 Fairness-Accuracy Trade-off
The trade-off between accuracy and fairness is of importance in recommendation scenarios, where equally
treating different groups . sensitive attributes has been shown to sacrifice the recommendation performance.
Hence, it inspires us to identify specific unfairness issues; and define the fairness criteria carefully to
cover a wide range of use cases; and design some controllable methods, where the trade-off between fairness
and accuracy can be controlled. Moreover, existing methods largely assume that the sensitive attributes of
users are provided as part of the input. Such assumptions might not hold in certain real-
world scenarios — for example, in collaborative filtering, user profiles including sensitive attributes like age and
gender cause different patterns of their behaviors; however, such profiles are unobserved but implicitly affect
the recommendation performance. A research direction is to understand the dimensions of causality and design
fairness-aware collaborative filtering algorithms in case sensitive attributes are not readily available.
"
88,"6 CONCLUSIONS
In this article, with reviewing more than 180 papers, we systematically summarize the seven kinds of biases
in recommendation, along with providing their definitions and characteristics. We further devise a taxonomy
to organize and position existing debiasing approaches, with discussing their strengths and weaknesses. We
list some open problems and research topics worth to be further explored. We hope this survey can benefit
"
